{
  "$schema": "https://json-schema.org/draft/2020-12/schema",
  "$id": "https://collaborationos.local/schemas/cos-learning-candidate-record-v0.1.schema.json",
  "title": "COS Learning Candidate Record v0.1",
  "type": "object",
  "additionalProperties": false,
  "required": [
    "schema_version", "artifact_id", "candidate_id", "artifact_lifecycle", "created_at",
    "source_authority", "target", "intake", "source_cohort", "accepted_bindings", "authority_resolution",
    "disclosure", "routing", "maturity", "review_chain", "promotion_lineage",
    "supersession", "host_adoption", "automation", "stages", "protocol_outcome",
    "limitations", "expected_assertion"
  ],
  "properties": {
    "schema_version": {"const": "COS_LEARNING_CANDIDATE_RECORD_V0_1"},
    "artifact_id": {"$ref": "#/$defs/stable_id"},
    "candidate_id": {"$ref": "#/$defs/stable_id"},
    "artifact_lifecycle": {"enum": ["draft", "submitted", "under_review", "reviewed", "superseded"]},
    "created_at": {"$ref": "#/$defs/rfc3339"},
    "source_authority": {"type": "string", "minLength": 1},
    "target": {
      "type": "object", "additionalProperties": false,
      "required": ["protocol_id", "clause_id", "contract_version", "scope_predicates", "scope_digest"],
      "properties": {
        "protocol_id": {"const": "COS-P07"},
        "clause_id": {"type": "string", "pattern": "^P07-C(0[1-9]|1[01])$"},
        "contract_version": {"const": "v0.1"},
        "scope_predicates": {"type": "array", "minItems": 1, "uniqueItems": true, "items": {"type": "string", "minLength": 1}},
        "scope_digest": {"$ref": "#/$defs/sha256"}
      }
    },
    "intake": {
      "type": "object", "additionalProperties": false,
      "required": ["submission_ref", "submission_checksum", "host_submitter_claim", "cos_intake_registrar", "crosswalk_inventory_digest"],
      "properties": {
        "submission_ref": {"$ref": "#/$defs/stable_id"},
        "submission_checksum": {"$ref": "#/$defs/sha256"},
        "host_submitter_claim": {"type": "string", "minLength": 1},
        "cos_intake_registrar": {"$ref": "#/$defs/actor_tuple"},
        "crosswalk_inventory_digest": {"$ref": "#/$defs/sha256"}
      }
    },
    "source_cohort": {
      "type": "array", "minItems": 1,
      "items": {
        "type": "object", "additionalProperties": false,
        "required": ["host_identity", "host_alias", "host_authority_ref", "host_structure_fingerprint", "structural_dimensions", "event_id", "run_id", "actual_scope_predicates", "positive_path", "failure_path", "independent_acceptance", "manual_takeover"],
        "properties": {
          "host_identity": {"$ref": "#/$defs/stable_id"},
          "host_alias": {"type": "string", "minLength": 1},
          "host_authority_ref": {"type": "string", "minLength": 1},
          "host_structure_fingerprint": {"$ref": "#/$defs/sha256"},
          "structural_dimensions": {"type": "array", "minItems": 1, "uniqueItems": true, "items": {"enum": ["authority_topology", "delivery_lifecycle", "artifact_ownership", "execution_environment", "failure_surface"]}},
          "event_id": {"$ref": "#/$defs/stable_id"},
          "run_id": {"$ref": "#/$defs/stable_id"},
          "actual_scope_predicates": {"type": "array", "minItems": 1, "uniqueItems": true, "items": {"type": "string", "minLength": 1}},
          "positive_path": {"$ref": "#/$defs/truth_state"},
          "failure_path": {"$ref": "#/$defs/truth_state"},
          "independent_acceptance": {"enum": ["passed", "failed", "not_attempted", "not_applicable", "not_observed"]},
          "manual_takeover": {"enum": ["used", "available_not_used", "required_not_available", "not_applicable", "not_observed"]}
        }
      }
    },
    "accepted_bindings": {
      "type": "object", "additionalProperties": false,
      "required": ["a02", "a03", "a07", "a08"],
      "properties": {
        "a02": {"$ref": "#/$defs/source_binding"},
        "a03": {"$ref": "#/$defs/source_binding"},
        "a07": {"$ref": "#/$defs/source_binding"},
        "a08": {"$ref": "#/$defs/source_binding"}
      }
    },
    "authority_resolution": {
      "type": "object", "additionalProperties": false,
      "required": ["reviewer", "promotion_owner", "canonical_owner", "self_review_exception", "action_policy_digest"],
      "properties": {
        "reviewer": {"$ref": "#/$defs/actor_tuple"},
        "promotion_owner": {"$ref": "#/$defs/actor_tuple"},
        "canonical_owner": {"$ref": "#/$defs/actor_tuple"},
        "self_review_exception": {
          "type": "object", "additionalProperties": false,
          "required": ["status", "request_id", "request_checksum", "decision_id", "decision_checksum", "candidate_id", "scope", "effective_at", "expires_at"],
          "properties": {
            "status": {"enum": ["not_requested", "approved"]},
            "request_id": {"$ref": "#/$defs/ref_or_na"},
            "request_checksum": {"$ref": "#/$defs/sha_or_na"},
            "decision_id": {"$ref": "#/$defs/ref_or_na"},
            "decision_checksum": {"$ref": "#/$defs/sha_or_na"},
            "candidate_id": {"$ref": "#/$defs/ref_or_na"},
            "scope": {"type": "string", "minLength": 1},
            "effective_at": {"type": "string", "minLength": 1},
            "expires_at": {"type": "string", "minLength": 1}
          }
        },
        "action_policy_digest": {"$ref": "#/$defs/sha256"}
      }
    },
    "disclosure": {
      "type": "object", "additionalProperties": false,
      "required": ["review_observation", "redaction_result", "secret_present", "nda_present", "personal_data_present", "forbidden_business_payload_present", "reason"],
      "properties": {
        "review_observation": {"enum": ["observed", "not_observed", "unavailable"]},
        "redaction_result": {"enum": ["passed", "failed", "not_observed"]},
        "secret_present": {"type": "boolean"},
        "nda_present": {"type": "boolean"},
        "personal_data_present": {"type": "boolean"},
        "forbidden_business_payload_present": {"type": "boolean"},
        "reason": {"type": "string"}
      }
    },
    "routing": {
      "type": "object", "additionalProperties": false,
      "required": ["submitted_route", "reviewed_route", "split_children", "reason"],
      "properties": {
        "submitted_route": {"enum": ["COS_CORE_CANDIDATE", "HOST_DOMAIN_EXTENSION", "AI_NATIVE_CAPABILITY", "MIXED_SPLIT", "REJECT_NO_COS_RELEVANCE"]},
        "reviewed_route": {"enum": ["COS_CORE_CANDIDATE", "DOMAIN_EXTENSION_ONLY", "AI_NATIVE_CAPABILITY", "MIXED_SPLIT", "REJECT_NO_COS_RELEVANCE"]},
        "split_children": {"type": "array", "uniqueItems": true, "items": {"$ref": "#/$defs/split_child"}},
        "reason": {"type": "string", "minLength": 1}
      }
    },
    "maturity": {
      "type": "object", "additionalProperties": false,
      "required": ["current_observation", "current_state", "derived_ceiling", "recommended_state", "final_state", "cohort_digest", "host_policy_digest", "limitation_policy_digest"],
      "properties": {
        "current_observation": {"enum": ["observed", "not_observed"]},
        "current_state": {"$ref": "#/$defs/maturity_or_not_observed"},
        "derived_ceiling": {"enum": ["OBSERVED_SINGLE_HOST", "VALIDATED_SAME_HOST", "SUPPORTED_CROSS_HOST", "DOMAIN_EXTENSION_ONLY", "REJECTED_OR_SUPERSEDED"]},
        "recommended_state": {"$ref": "#/$defs/maturity_state"},
        "final_state": {"$ref": "#/$defs/maturity_state"},
        "cohort_digest": {"$ref": "#/$defs/sha256"},
        "host_policy_digest": {"$ref": "#/$defs/sha256"},
        "limitation_policy_digest": {"$ref": "#/$defs/sha256"}
      }
    },
    "review_chain": {
      "type": "array", "minItems": 1,
      "items": {"$ref": "#/$defs/review_event"}
    },
    "promotion_lineage": {
      "type": "object", "additionalProperties": false,
      "required": ["required", "basis_review_event_id", "basis_review_event_checksum", "decision_id", "decision_checksum", "decision_result", "build_log_ref", "build_log_checksum", "core_change_ref", "core_change_checksum", "core_version", "final_event_id", "final_event_checksum"],
      "properties": {
        "required": {"type": "boolean"},
        "basis_review_event_id": {"$ref": "#/$defs/ref_or_na"},
        "basis_review_event_checksum": {"$ref": "#/$defs/sha_or_na"},
        "decision_id": {"$ref": "#/$defs/ref_or_na"},
        "decision_checksum": {"$ref": "#/$defs/sha_or_na"},
        "decision_result": {"enum": ["approve", "reject", "defer", "not_applicable", "not_decided"]},
        "build_log_ref": {"$ref": "#/$defs/ref_or_na"},
        "build_log_checksum": {"$ref": "#/$defs/sha_or_na"},
        "core_change_ref": {"$ref": "#/$defs/ref_or_na"},
        "core_change_checksum": {"$ref": "#/$defs/sha_or_na"},
        "core_version": {"type": "string", "minLength": 1},
        "final_event_id": {"$ref": "#/$defs/ref_or_na"},
        "final_event_checksum": {"$ref": "#/$defs/sha_or_na"}
      }
    },
    "supersession": {
      "type": "object", "additionalProperties": false,
      "required": ["predecessor_candidate_id", "successor_candidate_id", "registry_digest"],
      "properties": {
        "predecessor_candidate_id": {"$ref": "#/$defs/ref_or_na"},
        "successor_candidate_id": {"$ref": "#/$defs/ref_or_na"},
        "registry_digest": {"$ref": "#/$defs/sha256"}
      }
    },
    "host_adoption": {
      "type": "object", "additionalProperties": false,
      "required": ["status", "host_decision_ref"],
      "properties": {
        "status": {"enum": ["not_reviewed", "ALREADY_CONFORMANT", "ADAPT", "NOT_APPLICABLE", "CONFLICT", "DEFER"]},
        "host_decision_ref": {"$ref": "#/$defs/ref_or_na"}
      }
    },
    "automation": {
      "type": "object", "additionalProperties": false,
      "required": ["automatic_submission", "automatic_evidence_admission", "automatic_review_acceptance", "automatic_maturity_transition", "automatic_decision", "automatic_apply", "automatic_promotion", "automatic_canonical_write", "automatic_release", "automatic_host_adoption", "automatic_external_call", "runtime_invocation"],
      "properties": {
        "automatic_submission": {"const": false},
        "automatic_evidence_admission": {"const": false},
        "automatic_review_acceptance": {"const": false},
        "automatic_maturity_transition": {"const": false},
        "automatic_decision": {"const": false},
        "automatic_apply": {"const": false},
        "automatic_promotion": {"const": false},
        "automatic_canonical_write": {"const": false},
        "automatic_release": {"const": false},
        "automatic_host_adoption": {"const": false},
        "automatic_external_call": {"const": false},
        "runtime_invocation": {"const": false}
      }
    },
    "stages": {
      "type": "array", "minItems": 10, "maxItems": 10,
      "items": {"$ref": "#/$defs/stage"}
    },
    "protocol_outcome": {"enum": ["success", "partial_success", "legal_stop", "failed"]},
    "limitations": {"type": "array", "items": {"$ref": "#/$defs/limitation"}},
    "expected_assertion": {
      "type": "object", "additionalProperties": false,
      "required": ["assertion_id", "expected_outcome", "target_reached"],
      "properties": {
        "assertion_id": {"type": "string", "pattern": "^M5D-AST-(0[1-9]|[12][0-9]|3[0-2])$"},
        "expected_outcome": {"enum": ["success", "partial_success", "legal_stop", "failed"]},
        "target_reached": {"type": "boolean"}
      }
    }
  },
  "$defs": {
    "stable_id": {"type": "string", "pattern": "^[A-Za-z0-9][A-Za-z0-9._:-]{2,127}$"},
    "sha256": {"type": "string", "pattern": "^[a-f0-9]{64}$"},
    "rfc3339": {"type": "string", "pattern": "^\\d{4}-\\d{2}-\\d{2}T\\d{2}:\\d{2}:\\d{2}(?:\\.\\d+)?(?:Z|[+-]\\d{2}:\\d{2})$"},
    "ref_or_na": {"type": "string", "pattern": "^(?:[A-Za-z0-9][A-Za-z0-9._:-]{2,127}|not_applicable|not_decided|not_observed)$"},
    "sha_or_na": {"type": "string", "pattern": "^(?:[a-f0-9]{64}|not_applicable|not_decided|not_observed)$"},
    "truth_state": {"enum": ["reached", "not_reached", "not_attempted", "not_applicable", "not_observed"]},
    "maturity_state": {"enum": ["OBSERVED_SINGLE_HOST", "VALIDATED_SAME_HOST", "SUPPORTED_CROSS_HOST", "PROMOTED_CORE", "DOMAIN_EXTENSION_ONLY", "REJECTED_OR_SUPERSEDED"]},
    "maturity_or_not_observed": {"enum": ["OBSERVED_SINGLE_HOST", "VALIDATED_SAME_HOST", "SUPPORTED_CROSS_HOST", "PROMOTED_CORE", "DOMAIN_EXTENSION_ONLY", "REJECTED_OR_SUPERSEDED", "not_observed"]},
    "source_binding": {
      "type": "object", "additionalProperties": false,
      "required": ["artifact_id", "artifact_checksum", "current_event_id", "current_event_checksum", "lifecycle", "source_ref", "cutoff"],
      "properties": {
        "artifact_id": {"$ref": "#/$defs/ref_or_na"},
        "artifact_checksum": {"$ref": "#/$defs/sha_or_na"},
        "current_event_id": {"$ref": "#/$defs/ref_or_na"},
        "current_event_checksum": {"$ref": "#/$defs/sha_or_na"},
        "lifecycle": {"enum": ["accepted", "superseded", "not_applicable", "not_observed"]},
        "source_ref": {"type": "string", "minLength": 1},
        "cutoff": {"$ref": "#/$defs/rfc3339"}
      }
    },
    "actor_tuple": {
      "type": "object", "additionalProperties": false,
      "required": ["actor_id", "actor_kind", "role", "role_binding_id", "authority_domain", "governed_scope", "authority_source_ref", "authority_source_checksum", "a03_artifact_id", "a03_checksum", "a03_current_event_id", "a03_current_event_checksum", "permission_ids", "effective_allowed"],
      "properties": {
        "actor_id": {"$ref": "#/$defs/stable_id"},
        "actor_kind": {"enum": ["human", "ai_agent", "deterministic_system", "organization_ref"]},
        "role": {"enum": ["proposer", "reviewer", "decision_owner", "authority_owner"]},
        "role_binding_id": {"$ref": "#/$defs/stable_id"},
        "authority_domain": {"enum": ["final_direction", "acceptance", "promotion", "canonical_release"]},
        "governed_scope": {"type": "string", "minLength": 1},
        "authority_source_ref": {"type": "string", "minLength": 1},
        "authority_source_checksum": {"$ref": "#/$defs/sha256"},
        "a03_artifact_id": {"$ref": "#/$defs/stable_id"},
        "a03_checksum": {"$ref": "#/$defs/sha256"},
        "a03_current_event_id": {"$ref": "#/$defs/stable_id"},
        "a03_current_event_checksum": {"$ref": "#/$defs/sha256"},
        "permission_ids": {"type": "array", "minItems": 1, "uniqueItems": true, "items": {"enum": ["propose", "accept_result", "make_decision", "promote_core", "canonical_write", "release_product"]}},
        "effective_allowed": {"type": "boolean"}
      }
    },
    "split_child": {
      "type": "object", "additionalProperties": false,
      "required": ["candidate_id", "route", "scope_digest", "owner_actor_id"],
      "properties": {
        "candidate_id": {"$ref": "#/$defs/stable_id"},
        "route": {"enum": ["COS_CORE_CANDIDATE", "DOMAIN_EXTENSION_ONLY", "AI_NATIVE_CAPABILITY", "REJECT_NO_COS_RELEVANCE"]},
        "scope_digest": {"$ref": "#/$defs/sha256"},
        "owner_actor_id": {"$ref": "#/$defs/stable_id"}
      }
    },
    "review_event": {
      "type": "object", "additionalProperties": false,
      "required": ["event_id", "sequence", "previous_event_id", "previous_event_checksum", "event_checksum", "candidate_checksum", "source_set_digest", "reviewer", "reviewed_route", "derived_ceiling", "recommendation", "reason", "reviewed_at"],
      "properties": {
        "event_id": {"$ref": "#/$defs/stable_id"},
        "sequence": {"type": "integer", "minimum": 1},
        "previous_event_id": {"$ref": "#/$defs/ref_or_na"},
        "previous_event_checksum": {"$ref": "#/$defs/sha_or_na"},
        "event_checksum": {"$ref": "#/$defs/sha256"},
        "candidate_checksum": {"$ref": "#/$defs/sha256"},
        "source_set_digest": {"$ref": "#/$defs/sha256"},
        "reviewer": {"$ref": "#/$defs/actor_tuple"},
        "reviewed_route": {"enum": ["COS_CORE_CANDIDATE", "DOMAIN_EXTENSION_ONLY", "AI_NATIVE_CAPABILITY", "MIXED_SPLIT", "REJECT_NO_COS_RELEVANCE"]},
        "derived_ceiling": {"enum": ["OBSERVED_SINGLE_HOST", "VALIDATED_SAME_HOST", "SUPPORTED_CROSS_HOST", "DOMAIN_EXTENSION_ONLY", "REJECTED_OR_SUPERSEDED"]},
        "recommendation": {"enum": ["ADOPT", "ADAPT", "DEFER", "REJECT"]},
        "reason": {"type": "string", "minLength": 1},
        "reviewed_at": {"$ref": "#/$defs/rfc3339"}
      }
    },
    "stage": {
      "type": "object", "additionalProperties": false,
      "required": ["stage_id", "status", "invoked", "reason"],
      "properties": {
        "stage_id": {"enum": ["bind_candidate_sources", "validate_disclosure_and_redaction", "verify_evidence_admission_and_reachability", "classify_route_and_split_ownership", "derive_maturity_ceiling", "resolve_independent_reviewer_authority", "record_candidate_review_recommendation", "bind_human_promotion_decision_if_required", "record_promotion_or_nonpromotion_disposition", "reduce_p07_outcome"]},
        "status": {"enum": ["completed", "skipped", "disabled", "not_attempted", "legal_stop", "failed"]},
        "invoked": {"type": "boolean"},
        "reason": {"type": "string"}
      }
    },
    "limitation": {
      "type": "object", "additionalProperties": false,
      "required": ["code", "classification", "accepted_by_reviewer", "reason"],
      "properties": {
        "code": {"type": "string", "minLength": 1},
        "classification": {"enum": ["required", "optional"]},
        "accepted_by_reviewer": {"type": "boolean"},
        "reason": {"type": "string", "minLength": 1}
      }
    }
  }
}
